{
  "schema_version": "event-v1",
  "event_id": "EVT-NANSWAP-0005",
  "event_type": "OPPORTUNITY_VERA_DECISION",
  "subject_type": "opportunity",
  "subject_id": "OPP-NANSWAP-RANDOMX-0001",
  "actor": "vera:principal",
  "recorded_at": "2026-10-06T10:35:31Z",
  "correlation_id": "CORR-NANSWAP-RANDOMX-0001",
  "causation_id": "EVT-NANSWAP-0004",
  "idempotency_key": "nanswap-randomx:v1:vera-decision",
  "from_state": "SCREENING",
  "to_state": "VERA_DECISION",
  "payload": {
    "decision": "ADOPT_PRIOR_RECOMMENDATION",
    "reason": "Patrick resolved the third-party terms boundary exactly as recommended. The bounded test has zero customer-acquisition requirement, uses already-verified software, existing receiving infrastructure, no speculative capital, and a deterministic stop condition.",
    "claim_ceiling": "Approval authorizes only the bounded test. It does not establish profitability or authorize continuous mining."
  },
  "external_effect": false
}