{
  "schema_version":"event-v1",
  "event_id":"EVT-BOUNTY-STREAMR99-0003",
  "event_type":"OPPORTUNITY_VERA_DECISION",
  "subject_type":"opportunity",
  "subject_id":"OPP-FIRST-DOLLAR-STREAMR99-BOUNTY-0001",
  "actor":"vera:principal",
  "recorded_at":"2026-10-09T18:49:02Z",
  "correlation_id":"CORR-FIRST-DOLLAR-STREAMR99-BOUNTY-0001",
  "causation_id":"EVT-BOUNTY-STREAMR99-0002",
  "idempotency_key":"first-dollar:github-bounty:streamr-99:vera-decision:v1",
  "from_state":"SCREENING",
  "to_state":"VERA_DECISION",
  "payload":{
    "decision":"AUTHORIZE_LOCAL_PATCH_PREPARATION_ONLY",
    "reason":"This is an uncontested zero-capital bounty with a narrow contract invariant and strong reuse of the existing local Soroban test environment.",
    "claim_ceiling":"Clone/read public source, implement and validate locally on Lappy only; no claim comment, fork, push, PR, terms acceptance, payout setup, or other upstream external effect."
  },
  "external_effect":false
}