{
  "schema_version": "event-v1",
  "event_id": "EVT-BOUNTY-SPECULA10-0001",
  "event_type": "OPPORTUNITY_DISCOVERED",
  "subject_type": "opportunity",
  "subject_id": "OPP-FIRST-DOLLAR-SPECULA10-BOUNTY-0001",
  "actor": "vera:principal",
  "recorded_at": "2026-10-09T16:55:00Z",
  "correlation_id": "CORR-FIRST-DOLLAR-SPECULA10-BOUNTY-0001",
  "causation_id": "EVT-FIRST-DOLLAR-EXPAND-0002",
  "idempotency_key": "first-dollar:github-bounty:specula-api-10:discovered:v1",
  "from_state": null,
  "to_state": "DISCOVERED",
  "payload": {
    "objective": "Earn the Specula API #10 cash bounty by reusing one lazy module-level httpx client without changing existing error semantics.",
    "source": "https://github.com/Specula-Labs/specula-api/issues/10",
    "advertised_reward_usd": "85",
    "observed_state": "OPEN",
    "observed_comments": 0,
    "observed_assignees": 0,
    "customer_required": false,
    "upfront_capital_required": false
  },
  "external_effect": false
}
