{"schema_version":"event-v1","event_id":"EVT-BOUNTY-SIGNPOST102-0002","event_type":"OPPORTUNITY_SCREENING_STARTED","subject_type":"opportunity","subject_id":"OPP-FIRST-DOLLAR-SIGNPOST102-BOUNTY-0001","actor":"vera:works-operator","recorded_at":"2026-10-08T19:25:01Z","correlation_id":"CORR-FIRST-DOLLAR-SIGNPOST102-BOUNTY-0001","causation_id":"EVT-BOUNTY-SIGNPOST102-0001","idempotency_key":"first-dollar:github-bounty:signpost-contracts-102:screening:v1","from_state":"DISCOVERED","to_state":"SCREENING","payload":{"evidence_summary":["Direct GitHub issue observed open with zero comments and no assignee.","Advertised bounty is USD 95.","The requested work is a bounded shell regression harness around an existing checker and existing safe/breaking fixtures.","Acceptance asks for three deterministic exit-code assertions and wiring the harness into the existing contract CI lint job."],"recommended_test":"Prepare the smallest local patch that tests the existing storage-layout compatibility script against the supplied fixtures and invokes the harness from contract CI.","alternatives":["Signpost API #118 at USD 85 for placeholder-translator deduplication.","Streamr #7 at USD 65 for wallet host/balance tests.","VisionMe #56 at USD 100 for broad monorepo CI, with materially higher scope and baseline-risk."]},"external_effect":false}