{
  "schema_version": "event-v1",
  "event_id": "EVT-BOUNTY-STREAMR10-0003",
  "event_type": "OPPORTUNITY_VERA_DECISION",
  "subject_type": "opportunity",
  "subject_id": "OPP-FIRST-DOLLAR-STREAMR10-BOUNTY-0001",
  "actor": "vera:principal",
  "recorded_at": "2026-10-08T18:34:02Z",
  "correlation_id": "CORR-FIRST-DOLLAR-STREAMR10-BOUNTY-0001",
  "causation_id": "EVT-BOUNTY-STREAMR10-0002",
  "idempotency_key": "first-dollar:github-bounty:streamr10:vera-decision:v1",
  "from_state": "SCREENING",
  "to_state": "VERA_DECISION",
  "payload": {
    "decision": "AUTHORIZE_LOCAL_PATCH_PREPARATION_ONLY",
    "reason": "This is an uncontested zero-capital bounty in an already-inspected repository, with bounded deterministic test work and strong setup reuse.",
    "claim_ceiling": "Clone/read public source, implement and test locally on Lappy only; no claim comment, fork, push, PR, terms acceptance, payout setup, or other external effect."
  },
  "external_effect": false
}
