{
  "schema_version": "event-v1",
  "event_id": "EVT-BOUNTY-STREAMR94-0003",
  "event_type": "OPPORTUNITY_VERA_DECISION",
  "subject_type": "opportunity",
  "subject_id": "OPP-FIRST-DOLLAR-STREAMR94-BOUNTY-0001",
  "actor": "vera:principal",
  "recorded_at": "2026-10-09T20:05:02Z",
  "correlation_id": "CORR-FIRST-DOLLAR-STREAMR94-BOUNTY-0001",
  "causation_id": "EVT-BOUNTY-STREAMR94-0002",
  "idempotency_key": "first-dollar:github-bounty:streamr-94:vera-decision:v1",
  "from_state": "SCREENING",
  "to_state": "VERA_DECISION",
  "payload": {
    "decision": "AUTHORIZE_LOCAL_PATCH_PREPARATION_ONLY",
    "reason": "This is an uncontested zero-capital bounty with a narrow deterministic UI accessibility patch surface and favorable expected dollars per hour.",
    "claim_ceiling": "Read public source, implement and test locally on Lappy only; no issue claim, fork, upstream push, PR, terms acceptance, payout setup, or other external effect."
  },
  "external_effect": false
}
