{
  "schema_version": "event-v1",
  "event_id": "EVT-BOUNTY-STREAMR92-0004",
  "event_type": "OPPORTUNITY_APPROVED",
  "subject_type": "opportunity",
  "subject_id": "OPP-FIRST-DOLLAR-STREAMR92-BOUNTY-0001",
  "actor": "vera:principal",
  "recorded_at": "2026-10-09T20:17:03Z",
  "correlation_id": "CORR-FIRST-DOLLAR-STREAMR92-BOUNTY-0001",
  "causation_id": "EVT-BOUNTY-STREAMR92-0003",
  "idempotency_key": "first-dollar:github-bounty:streamr-92:local-prep-approved:v1",
  "from_state": "VERA_DECISION",
  "to_state": "APPROVED",
  "payload": {
    "approved_effect": "On Lappy, prepare and validate a clean Streamr #92 patch from current public main that deletes unused exports and centralizes the month-duration constant.",
    "stop_conditions": [
      "Stop before public issue comment, claim, fork, upstream push, pull request, terms, or payout step.",
      "Stop if secrets, spend, production access, destructive external testing, or nonpublic data are required.",
      "Stop if fresh issue state shows the bounty closed or claimed."
    ],
    "explicit_exclusions": [
      "No WorkLaptop.",
      "No external account creation.",
      "No terms acceptance.",
      "No identity, tax, wallet, or payout submission.",
      "No upstream public GitHub publication.",
      "No spending."
    ],
    "external_effect_not_yet_performed_by_this_event": true
  },
  "external_effect": false
}
